[I 2025-04-01 15:58:20,204] Trial 16 finished with value: 0.9890935097443233 and parameters: {'lr': 3.6493335306410487e-06, 'weight_decay': 3.54641141177549e-05, 'loss_fn': 'CrossEntropy', 'optimizer': 'RMSprop'}. Best is trial 14 with value: 0.9892665474060823.
C:\Users\sthem\AppData\Local\Temp\ipykernel_36240\549330364.py:76: FutureWarning: You are using `torch.load` with `weights_only=False` (the current default value), which uses the default pickle module implicitly. It is possible to construct malicious pickle data which will execute arbitrary code during unpickling (See https://github.com/pytorch/pytorch/blob/main/SECURITY.md#untrusted-models for more details). In a future release, the default value for `weights_only` will be flipped to `True`. This limits the functions that could be executed during unpickling. Arbitrary objects will no longer be allowed to be loaded via this mode unless they are explicitly allowlisted by the user via `torch.serialization.add_safe_globals`. We recommend you start setting `weights_only=True` for any use case where you don't have full control of the loaded file. Please open an issue on GitHub for any issues related to this experimental feature.
  model.load_state_dict(torch.load(model_path, map_location=device))
[I 2025-04-01 16:02:49,135] Trial 17 finished with value: 0.9894473260597388 and parameters: {'lr': 3.79041438895189e-06, 'weight_decay': 3.0504601718990082e-05, 'loss_fn': 'CrossEntropy', 'optimizer': 'RMSprop'}. Best is trial 17 with value: 0.9894473260597388.
C:\Users\sthem\AppData\Local\Temp\ipykernel_36240\549330364.py:76: FutureWarning: You are using `torch.load` with `weights_only=False` (the current default value), which uses the default pickle module implicitly. It is possible to construct malicious pickle data which will execute arbitrary code during unpickling (See https://github.com/pytorch/pytorch/blob/main/SECURITY.md#untrusted-models for more details). In a future release, the default value for `weights_only` will be flipped to `True`. This limits the functions that could be executed during unpickling. Arbitrary objects will no longer be allowed to be loaded via this mode unless they are explicitly allowlisted by the user via `torch.serialization.add_safe_globals`. We recommend you start setting `weights_only=True` for any use case where you don't have full control of the loaded file. Please open an issue on GitHub for any issues related to this experimental feature.
  model.load_state_dict(torch.load(model_path, map_location=device))
[I 2025-04-01 16:07:20,576] Trial 18 finished with value: 0.9890935097443233 and parameters: {'lr': 6.755809588169163e-06, 'weight_decay': 3.7697641348715508e-06, 'loss_fn': 'BCE', 'optimizer': 'Adam'}. Best is trial 17 with value: 0.9894473260597388.
C:\Users\sthem\AppData\Local\Temp\ipykernel_36240\549330364.py:76: FutureWarning: You are using `torch.load` with `weights_only=False` (the current default value), which uses the default pickle module implicitly. It is possible to construct malicious pickle data which will execute arbitrary code during unpickling (See https://github.com/pytorch/pytorch/blob/main/SECURITY.md#untrusted-models for more details). In a future release, the default value for `weights_only` will be flipped to `True`. This limits the functions that could be executed during unpickling. Arbitrary objects will no longer be allowed to be loaded via this mode unless they are explicitly allowlisted by the user via `torch.serialization.add_safe_globals`. We recommend you start setting `weights_only=True` for any use case where you don't have full control of the loaded file. Please open an issue on GitHub for any issues related to this experimental feature.
  model.load_state_dict(torch.load(model_path, map_location=device))
[I 2025-04-01 16:11:45,461] Trial 19 finished with value: 0.9876675603217158 and parameters: {'lr': 1.8538904679954219e-06, 'weight_decay': 2.2114184156301196e-05, 'loss_fn': 'CrossEntropy', 'optimizer': 'SGD'}. Best is trial 17 with value: 0.9894473260597388.
C:\Users\sthem\AppData\Local\Temp\ipykernel_36240\549330364.py:76: FutureWarning: You are using `torch.load` with `weights_only=False` (the current default value), which uses the default pickle module implicitly. It is possible to construct malicious pickle data which will execute arbitrary code during unpickling (See https://github.com/pytorch/pytorch/blob/main/SECURITY.md#untrusted-models for more details). In a future release, the default value for `weights_only` will be flipped to `True`. This limits the functions that could be executed during unpickling. Arbitrary objects will no longer be allowed to be loaded via this mode unless they are explicitly allowlisted by the user via `torch.serialization.add_safe_globals`. We recommend you start setting `weights_only=True` for any use case where you don't have full control of the loaded file. Please open an issue on GitHub for any issues related to this experimental feature.
  model.load_state_dict(torch.load(model_path, map_location=device))
[I 2025-04-01 16:16:16,638] Trial 20 finished with value: 0.9890857040615495 and parameters: {'lr': 2.253600120476623e-06, 'weight_decay': 6.5073369944167416e-06, 'loss_fn': 'CrossEntropy', 'optimizer': 'RMSprop'}. Best is trial 17 with value: 0.9894473260597388.
C:\Users\sthem\AppData\Local\Temp\ipykernel_36240\549330364.py:76: FutureWarning: You are using `torch.load` with `weights_only=False` (the current default value), which uses the default pickle module implicitly. It is possible to construct malicious pickle data which will execute arbitrary code during unpickling (See https://github.com/pytorch/pytorch/blob/main/SECURITY.md#untrusted-models for more details). In a future release, the default value for `weights_only` will be flipped to `True`. This limits the functions that could be executed during unpickling. Arbitrary objects will no longer be allowed to be loaded via this mode unless they are explicitly allowlisted by the user via `torch.serialization.add_safe_globals`. We recommend you start setting `weights_only=True` for any use case where you don't have full control of the loaded file. Please open an issue on GitHub for any issues related to this experimental feature.
  model.load_state_dict(torch.load(model_path, map_location=device))
[I 2025-04-01 16:20:45,866] Trial 21 finished with value: 0.9887399463806971 and parameters: {'lr': 3.5178683863249478e-06, 'weight_decay': 3.8741145512476215e-05, 'loss_fn': 'CrossEntropy', 'optimizer': 'RMSprop'}. Best is trial 17 with value: 0.9894473260597388.
C:\Users\sthem\AppData\Local\Temp\ipykernel_36240\549330364.py:76: FutureWarning: You are using `torch.load` with `weights_only=False` (the current default value), which uses the default pickle module implicitly. It is possible to construct malicious pickle data which will execute arbitrary code during unpickling (See https://github.com/pytorch/pytorch/blob/main/SECURITY.md#untrusted-models for more details). In a future release, the default value for `weights_only` will be flipped to `True`. This limits the functions that could be executed during unpickling. Arbitrary objects will no longer be allowed to be loaded via this mode unless they are explicitly allowlisted by the user via `torch.serialization.add_safe_globals`. We recommend you start setting `weights_only=True` for any use case where you don't have full control of the loaded file. Please open an issue on GitHub for any issues related to this experimental feature.
  model.load_state_dict(torch.load(model_path, map_location=device))
[I 2025-04-01 16:25:15,201] Trial 22 finished with value: 0.9885591705398641 and parameters: {'lr': 1.0007443818763487e-06, 'weight_decay': 1.2359321842017507e-05, 'loss_fn': 'CrossEntropy', 'optimizer': 'RMSprop'}. Best is trial 17 with value: 0.9894473260597388.
C:\Users\sthem\AppData\Local\Temp\ipykernel_36240\549330364.py:76: FutureWarning: You are using `torch.load` with `weights_only=False` (the current default value), which uses the default pickle module implicitly. It is possible to construct malicious pickle data which will execute arbitrary code during unpickling (See https://github.com/pytorch/pytorch/blob/main/SECURITY.md#untrusted-models for more details). In a future release, the default value for `weights_only` will be flipped to `True`. This limits the functions that could be executed during unpickling. Arbitrary objects will no longer be allowed to be loaded via this mode unless they are explicitly allowlisted by the user via `torch.serialization.add_safe_globals`. We recommend you start setting `weights_only=True` for any use case where you don't have full control of the loaded file. Please open an issue on GitHub for any issues related to this experimental feature.
  model.load_state_dict(torch.load(model_path, map_location=device))
[I 2025-04-01 16:29:44,763] Trial 23 finished with value: 0.9887359198998749 and parameters: {'lr': 7.57577305532305e-06, 'weight_decay': 4.5753799535183524e-05, 'loss_fn': 'CrossEntropy', 'optimizer': 'RMSprop'}. Best is trial 17 with value: 0.9894473260597388.
C:\Users\sthem\AppData\Local\Temp\ipykernel_36240\549330364.py:76: FutureWarning: You are using `torch.load` with `weights_only=False` (the current default value), which uses the default pickle module implicitly. It is possible to construct malicious pickle data which will execute arbitrary code during unpickling (See https://github.com/pytorch/pytorch/blob/main/SECURITY.md#untrusted-models for more details). In a future release, the default value for `weights_only` will be flipped to `True`. This limits the functions that could be executed during unpickling. Arbitrary objects will no longer be allowed to be loaded via this mode unless they are explicitly allowlisted by the user via `torch.serialization.add_safe_globals`. We recommend you start setting `weights_only=True` for any use case where you don't have full control of the loaded file. Please open an issue on GitHub for any issues related to this experimental feature.
  model.load_state_dict(torch.load(model_path, map_location=device))
[I 2025-04-01 16:34:14,071] Trial 24 finished with value: 0.9887399463806971 and parameters: {'lr': 2.82600840786536e-06, 'weight_decay': 1.3183382932333616e-05, 'loss_fn': 'CrossEntropy', 'optimizer': 'RMSprop'}. Best is trial 17 with value: 0.9894473260597388.
C:\Users\sthem\AppData\Local\Temp\ipykernel_36240\549330364.py:76: FutureWarning: You are using `torch.load` with `weights_only=False` (the current default value), which uses the default pickle module implicitly. It is possible to construct malicious pickle data which will execute arbitrary code during unpickling (See https://github.com/pytorch/pytorch/blob/main/SECURITY.md#untrusted-models for more details). In a future release, the default value for `weights_only` will be flipped to `True`. This limits the functions that could be executed during unpickling. Arbitrary objects will no longer be allowed to be loaded via this mode unless they are explicitly allowlisted by the user via `torch.serialization.add_safe_globals`. We recommend you start setting `weights_only=True` for any use case where you don't have full control of the loaded file. Please open an issue on GitHub for any issues related to this experimental feature.
  model.load_state_dict(torch.load(model_path, map_location=device))
[I 2025-04-01 16:38:45,238] Trial 25 finished with value: 0.9899821109123434 and parameters: {'lr': 9.597089396219724e-06, 'weight_decay': 1.682757828554389e-06, 'loss_fn': 'CrossEntropy', 'optimizer': 'RMSprop'}. Best is trial 25 with value: 0.9899821109123434.
C:\Users\sthem\AppData\Local\Temp\ipykernel_36240\549330364.py:76: FutureWarning: You are using `torch.load` with `weights_only=False` (the current default value), which uses the default pickle module implicitly. It is possible to construct malicious pickle data which will execute arbitrary code during unpickling (See https://github.com/pytorch/pytorch/blob/main/SECURITY.md#untrusted-models for more details). In a future release, the default value for `weights_only` will be flipped to `True`. This limits the functions that could be executed during unpickling. Arbitrary objects will no longer be allowed to be loaded via this mode unless they are explicitly allowlisted by the user via `torch.serialization.add_safe_globals`. We recommend you start setting `weights_only=True` for any use case where you don't have full control of the loaded file. Please open an issue on GitHub for any issues related to this experimental feature.
  model.load_state_dict(torch.load(model_path, map_location=device))
[I 2025-04-01 16:43:21,927] Trial 26 finished with value: 0.9894359892569382 and parameters: {'lr': 1.0735357838569824e-05, 'weight_decay': 1.110627118574612e-06, 'loss_fn': 'BCE', 'optimizer': 'RMSprop'}. Best is trial 25 with value: 0.9899821109123434.
C:\Users\sthem\AppData\Local\Temp\ipykernel_36240\549330364.py:76: FutureWarning: You are using `torch.load` with `weights_only=False` (the current default value), which uses the default pickle module implicitly. It is possible to construct malicious pickle data which will execute arbitrary code during unpickling (See https://github.com/pytorch/pytorch/blob/main/SECURITY.md#untrusted-models for more details). In a future release, the default value for `weights_only` will be flipped to `True`. This limits the functions that could be executed during unpickling. Arbitrary objects will no longer be allowed to be loaded via this mode unless they are explicitly allowlisted by the user via `torch.serialization.add_safe_globals`. We recommend you start setting `weights_only=True` for any use case where you don't have full control of the loaded file. Please open an issue on GitHub for any issues related to this experimental feature.
  model.load_state_dict(torch.load(model_path, map_location=device))
[I 2025-04-01 16:47:51,512] Trial 27 finished with value: 0.9889087656529517 and parameters: {'lr': 1.0156674209669141e-05, 'weight_decay': 1.1906177138583905e-06, 'loss_fn': 'BCE', 'optimizer': 'RMSprop'}. Best is trial 25 with value: 0.9899821109123434.
C:\Users\sthem\AppData\Local\Temp\ipykernel_36240\549330364.py:76: FutureWarning: You are using `torch.load` with `weights_only=False` (the current default value), which uses the default pickle module implicitly. It is possible to construct malicious pickle data which will execute arbitrary code during unpickling (See https://github.com/pytorch/pytorch/blob/main/SECURITY.md#untrusted-models for more details). In a future release, the default value for `weights_only` will be flipped to `True`. This limits the functions that could be executed during unpickling. Arbitrary objects will no longer be allowed to be loaded via this mode unless they are explicitly allowlisted by the user via `torch.serialization.add_safe_globals`. We recommend you start setting `weights_only=True` for any use case where you don't have full control of the loaded file. Please open an issue on GitHub for any issues related to this experimental feature.
  model.load_state_dict(torch.load(model_path, map_location=device))
[I 2025-04-01 16:52:16,639] Trial 28 finished with value: 0.9883741727776784 and parameters: {'lr': 4.032885443586869e-05, 'weight_decay': 2.484585799080245e-06, 'loss_fn': 'BCE', 'optimizer': 'SGD'}. Best is trial 25 with value: 0.9899821109123434.
C:\Users\sthem\AppData\Local\Temp\ipykernel_36240\549330364.py:76: FutureWarning: You are using `torch.load` with `weights_only=False` (the current default value), which uses the default pickle module implicitly. It is possible to construct malicious pickle data which will execute arbitrary code during unpickling (See https://github.com/pytorch/pytorch/blob/main/SECURITY.md#untrusted-models for more details). In a future release, the default value for `weights_only` will be flipped to `True`. This limits the functions that could be executed during unpickling. Arbitrary objects will no longer be allowed to be loaded via this mode unless they are explicitly allowlisted by the user via `torch.serialization.add_safe_globals`. We recommend you start setting `weights_only=True` for any use case where you don't have full control of the loaded file. Please open an issue on GitHub for any issues related to this experimental feature.
  model.load_state_dict(torch.load(model_path, map_location=device))
[I 2025-04-01 16:56:50,336] Trial 29 finished with value: 0.9892818863879957 and parameters: {'lr': 2.836347992954228e-05, 'weight_decay': 1.965550849510351e-06, 'loss_fn': 'BCE', 'optimizer': 'Adam'}. Best is trial 25 with value: 0.9899821109123434.


Study statistics: 
  Number of finished trials:  30
  Number of pruned trials:  0
  Number of complete trials:  30
Best trial:
  Value:  0.9899821109123434
  Params: 
    lr: 9.597089396219724e-06
    weight_decay: 1.682757828554389e-06
    loss_fn: CrossEntropy
    optimizer: RMSprop