[I 2025-04-01 14:34:49,083] A new study created in memory with name: no-name-e9d6a2bc-c157-4411-a4ed-d7fbf6c7ac54
C:\Users\sthem\AppData\Local\Temp\ipykernel_36240\549330364.py:76: FutureWarning: You are using `torch.load` with `weights_only=False` (the current default value), which uses the default pickle module implicitly. It is possible to construct malicious pickle data which will execute arbitrary code during unpickling (See https://github.com/pytorch/pytorch/blob/main/SECURITY.md#untrusted-models for more details). In a future release, the default value for `weights_only` will be flipped to `True`. This limits the functions that could be executed during unpickling. Arbitrary objects will no longer be allowed to be loaded via this mode unless they are explicitly allowlisted by the user via `torch.serialization.add_safe_globals`. We recommend you start setting `weights_only=True` for any use case where you don't have full control of the loaded file. Please open an issue on GitHub for any issues related to this experimental feature.
  model.load_state_dict(torch.load(model_path, map_location=device))
[I 2025-04-01 14:39:44,088] Trial 0 finished with value: 0.9881974248927039 and parameters: {'lr': 1.6846059476592655e-05, 'weight_decay': 0.00012152584417337198, 'loss_fn': 'CrossEntropy', 'optimizer': 'SGD'}. Best is trial 0 with value: 0.9881974248927039.
C:\Users\sthem\AppData\Local\Temp\ipykernel_36240\549330364.py:76: FutureWarning: You are using `torch.load` with `weights_only=False` (the current default value), which uses the default pickle module implicitly. It is possible to construct malicious pickle data which will execute arbitrary code during unpickling (See https://github.com/pytorch/pytorch/blob/main/SECURITY.md#untrusted-models for more details). In a future release, the default value for `weights_only` will be flipped to `True`. This limits the functions that could be executed during unpickling. Arbitrary objects will no longer be allowed to be loaded via this mode unless they are explicitly allowlisted by the user via `torch.serialization.add_safe_globals`. We recommend you start setting `weights_only=True` for any use case where you don't have full control of the loaded file. Please open an issue on GitHub for any issues related to this experimental feature.
  model.load_state_dict(torch.load(model_path, map_location=device))
[I 2025-04-01 14:45:23,013] Trial 1 finished with value: 0.9878441186986057 and parameters: {'lr': 4.28198174384017e-06, 'weight_decay': 0.00014057009004478656, 'loss_fn': 'CrossEntropy', 'optimizer': 'SGD'}. Best is trial 0 with value: 0.9881974248927039.
C:\Users\sthem\AppData\Local\Temp\ipykernel_36240\549330364.py:76: FutureWarning: You are using `torch.load` with `weights_only=False` (the current default value), which uses the default pickle module implicitly. It is possible to construct malicious pickle data which will execute arbitrary code during unpickling (See https://github.com/pytorch/pytorch/blob/main/SECURITY.md#untrusted-models for more details). In a future release, the default value for `weights_only` will be flipped to `True`. This limits the functions that could be executed during unpickling. Arbitrary objects will no longer be allowed to be loaded via this mode unless they are explicitly allowlisted by the user via `torch.serialization.add_safe_globals`. We recommend you start setting `weights_only=True` for any use case where you don't have full control of the loaded file. Please open an issue on GitHub for any issues related to this experimental feature.
  model.load_state_dict(torch.load(model_path, map_location=device))
[I 2025-04-01 14:50:37,015] Trial 2 finished with value: 0.9889166964604934 and parameters: {'lr': 1.4865492350998986e-05, 'weight_decay': 0.00012126332158192973, 'loss_fn': 'CrossEntropy', 'optimizer': 'RMSprop'}. Best is trial 2 with value: 0.9889166964604934.
C:\Users\sthem\AppData\Local\Temp\ipykernel_36240\549330364.py:76: FutureWarning: You are using `torch.load` with `weights_only=False` (the current default value), which uses the default pickle module implicitly. It is possible to construct malicious pickle data which will execute arbitrary code during unpickling (See https://github.com/pytorch/pytorch/blob/main/SECURITY.md#untrusted-models for more details). In a future release, the default value for `weights_only` will be flipped to `True`. This limits the functions that could be executed during unpickling. Arbitrary objects will no longer be allowed to be loaded via this mode unless they are explicitly allowlisted by the user via `torch.serialization.add_safe_globals`. We recommend you start setting `weights_only=True` for any use case where you don't have full control of the loaded file. Please open an issue on GitHub for any issues related to this experimental feature.
  model.load_state_dict(torch.load(model_path, map_location=device))
[I 2025-04-01 14:55:53,255] Trial 3 finished with value: 0.985945561288027 and parameters: {'lr': 5.317907523506469e-05, 'weight_decay': 0.0008013125050156663, 'loss_fn': 'CrossEntropy', 'optimizer': 'RMSprop'}. Best is trial 2 with value: 0.9889166964604934.
C:\Users\sthem\AppData\Local\Temp\ipykernel_36240\549330364.py:76: FutureWarning: You are using `torch.load` with `weights_only=False` (the current default value), which uses the default pickle module implicitly. It is possible to construct malicious pickle data which will execute arbitrary code during unpickling (See https://github.com/pytorch/pytorch/blob/main/SECURITY.md#untrusted-models for more details). In a future release, the default value for `weights_only` will be flipped to `True`. This limits the functions that could be executed during unpickling. Arbitrary objects will no longer be allowed to be loaded via this mode unless they are explicitly allowlisted by the user via `torch.serialization.add_safe_globals`. We recommend you start setting `weights_only=True` for any use case where you don't have full control of the loaded file. Please open an issue on GitHub for any issues related to this experimental feature.
  model.load_state_dict(torch.load(model_path, map_location=device))
[I 2025-04-01 15:01:12,454] Trial 4 finished with value: 0.9864672364672364 and parameters: {'lr': 5.858146274488884e-05, 'weight_decay': 0.002842710021090651, 'loss_fn': 'BCE', 'optimizer': 'Adam'}. Best is trial 2 with value: 0.9889166964604934.
C:\Users\sthem\AppData\Local\Temp\ipykernel_36240\549330364.py:76: FutureWarning: You are using `torch.load` with `weights_only=False` (the current default value), which uses the default pickle module implicitly. It is possible to construct malicious pickle data which will execute arbitrary code during unpickling (See https://github.com/pytorch/pytorch/blob/main/SECURITY.md#untrusted-models for more details). In a future release, the default value for `weights_only` will be flipped to `True`. This limits the functions that could be executed during unpickling. Arbitrary objects will no longer be allowed to be loaded via this mode unless they are explicitly allowlisted by the user via `torch.serialization.add_safe_globals`. We recommend you start setting `weights_only=True` for any use case where you don't have full control of the loaded file. Please open an issue on GitHub for any issues related to this experimental feature.
  model.load_state_dict(torch.load(model_path, map_location=device))
[I 2025-04-01 15:06:29,139] Trial 5 finished with value: 0.9721627408993576 and parameters: {'lr': 0.00018037119265595293, 'weight_decay': 1.2527668365086847e-06, 'loss_fn': 'BCE', 'optimizer': 'Adam'}. Best is trial 2 with value: 0.9889166964604934.
C:\Users\sthem\AppData\Local\Temp\ipykernel_36240\549330364.py:76: FutureWarning: You are using `torch.load` with `weights_only=False` (the current default value), which uses the default pickle module implicitly. It is possible to construct malicious pickle data which will execute arbitrary code during unpickling (See https://github.com/pytorch/pytorch/blob/main/SECURITY.md#untrusted-models for more details). In a future release, the default value for `weights_only` will be flipped to `True`. This limits the functions that could be executed during unpickling. Arbitrary objects will no longer be allowed to be loaded via this mode unless they are explicitly allowlisted by the user via `torch.serialization.add_safe_globals`. We recommend you start setting `weights_only=True` for any use case where you don't have full control of the loaded file. Please open an issue on GitHub for any issues related to this experimental feature.
  model.load_state_dict(torch.load(model_path, map_location=device))
[I 2025-04-01 15:11:41,597] Trial 6 finished with value: 0.9404192717910996 and parameters: {'lr': 0.00023396003240798864, 'weight_decay': 0.000751418053131414, 'loss_fn': 'BCE', 'optimizer': 'RMSprop'}. Best is trial 2 with value: 0.9889166964604934.
C:\Users\sthem\AppData\Local\Temp\ipykernel_36240\549330364.py:76: FutureWarning: You are using `torch.load` with `weights_only=False` (the current default value), which uses the default pickle module implicitly. It is possible to construct malicious pickle data which will execute arbitrary code during unpickling (See https://github.com/pytorch/pytorch/blob/main/SECURITY.md#untrusted-models for more details). In a future release, the default value for `weights_only` will be flipped to `True`. This limits the functions that could be executed during unpickling. Arbitrary objects will no longer be allowed to be loaded via this mode unless they are explicitly allowlisted by the user via `torch.serialization.add_safe_globals`. We recommend you start setting `weights_only=True` for any use case where you don't have full control of the loaded file. Please open an issue on GitHub for any issues related to this experimental feature.
  model.load_state_dict(torch.load(model_path, map_location=device))
[I 2025-04-01 15:16:14,863] Trial 7 finished with value: 0.9890739745656457 and parameters: {'lr': 2.2235612084358204e-05, 'weight_decay': 0.0010333684344323551, 'loss_fn': 'CrossEntropy', 'optimizer': 'RMSprop'}. Best is trial 7 with value: 0.9890739745656457.
C:\Users\sthem\AppData\Local\Temp\ipykernel_36240\549330364.py:76: FutureWarning: You are using `torch.load` with `weights_only=False` (the current default value), which uses the default pickle module implicitly. It is possible to construct malicious pickle data which will execute arbitrary code during unpickling (See https://github.com/pytorch/pytorch/blob/main/SECURITY.md#untrusted-models for more details). In a future release, the default value for `weights_only` will be flipped to `True`. This limits the functions that could be executed during unpickling. Arbitrary objects will no longer be allowed to be loaded via this mode unless they are explicitly allowlisted by the user via `torch.serialization.add_safe_globals`. We recommend you start setting `weights_only=True` for any use case where you don't have full control of the loaded file. Please open an issue on GitHub for any issues related to this experimental feature.
  model.load_state_dict(torch.load(model_path, map_location=device))
[I 2025-04-01 15:21:03,459] Trial 8 finished with value: 0.9885591705398641 and parameters: {'lr': 9.402937207923885e-06, 'weight_decay': 8.5518941247946e-05, 'loss_fn': 'CrossEntropy', 'optimizer': 'Adam'}. Best is trial 7 with value: 0.9890739745656457.
C:\Users\sthem\AppData\Local\Temp\ipykernel_36240\549330364.py:76: FutureWarning: You are using `torch.load` with `weights_only=False` (the current default value), which uses the default pickle module implicitly. It is possible to construct malicious pickle data which will execute arbitrary code during unpickling (See https://github.com/pytorch/pytorch/blob/main/SECURITY.md#untrusted-models for more details). In a future release, the default value for `weights_only` will be flipped to `True`. This limits the functions that could be executed during unpickling. Arbitrary objects will no longer be allowed to be loaded via this mode unless they are explicitly allowlisted by the user via `torch.serialization.add_safe_globals`. We recommend you start setting `weights_only=True` for any use case where you don't have full control of the loaded file. Please open an issue on GitHub for any issues related to this experimental feature.
  model.load_state_dict(torch.load(model_path, map_location=device))
[I 2025-04-01 15:26:07,105] Trial 9 finished with value: 0.9834842834310069 and parameters: {'lr': 5.3204152177573766e-05, 'weight_decay': 2.8066284957586358e-05, 'loss_fn': 'CrossEntropy', 'optimizer': 'RMSprop'}. Best is trial 7 with value: 0.9890739745656457.
C:\Users\sthem\AppData\Local\Temp\ipykernel_36240\549330364.py:76: FutureWarning: You are using `torch.load` with `weights_only=False` (the current default value), which uses the default pickle module implicitly. It is possible to construct malicious pickle data which will execute arbitrary code during unpickling (See https://github.com/pytorch/pytorch/blob/main/SECURITY.md#untrusted-models for more details). In a future release, the default value for `weights_only` will be flipped to `True`. This limits the functions that could be executed during unpickling. Arbitrary objects will no longer be allowed to be loaded via this mode unless they are explicitly allowlisted by the user via `torch.serialization.add_safe_globals`. We recommend you start setting `weights_only=True` for any use case where you don't have full control of the loaded file. Please open an issue on GitHub for any issues related to this experimental feature.
  model.load_state_dict(torch.load(model_path, map_location=device))
[I 2025-04-01 15:31:12,781] Trial 10 finished with value: 0.9883824843610366 and parameters: {'lr': 1.1172400695428e-06, 'weight_decay': 0.006686698639342679, 'loss_fn': 'BCE', 'optimizer': 'RMSprop'}. Best is trial 7 with value: 0.9890739745656457.
C:\Users\sthem\AppData\Local\Temp\ipykernel_36240\549330364.py:76: FutureWarning: You are using `torch.load` with `weights_only=False` (the current default value), which uses the default pickle module implicitly. It is possible to construct malicious pickle data which will execute arbitrary code during unpickling (See https://github.com/pytorch/pytorch/blob/main/SECURITY.md#untrusted-models for more details). In a future release, the default value for `weights_only` will be flipped to `True`. This limits the functions that could be executed during unpickling. Arbitrary objects will no longer be allowed to be loaded via this mode unless they are explicitly allowlisted by the user via `torch.serialization.add_safe_globals`. We recommend you start setting `weights_only=True` for any use case where you don't have full control of the loaded file. Please open an issue on GitHub for any issues related to this experimental feature.
  model.load_state_dict(torch.load(model_path, map_location=device))
[I 2025-04-01 15:35:50,135] Trial 11 finished with value: 0.67404378157325 and parameters: {'lr': 0.0007334259610338198, 'weight_decay': 1.1498668571429383e-05, 'loss_fn': 'CrossEntropy', 'optimizer': 'RMSprop'}. Best is trial 7 with value: 0.9890739745656457.
C:\Users\sthem\AppData\Local\Temp\ipykernel_36240\549330364.py:76: FutureWarning: You are using `torch.load` with `weights_only=False` (the current default value), which uses the default pickle module implicitly. It is possible to construct malicious pickle data which will execute arbitrary code during unpickling (See https://github.com/pytorch/pytorch/blob/main/SECURITY.md#untrusted-models for more details). In a future release, the default value for `weights_only` will be flipped to `True`. This limits the functions that could be executed during unpickling. Arbitrary objects will no longer be allowed to be loaded via this mode unless they are explicitly allowlisted by the user via `torch.serialization.add_safe_globals`. We recommend you start setting `weights_only=True` for any use case where you don't have full control of the loaded file. Please open an issue on GitHub for any issues related to this experimental feature.
  model.load_state_dict(torch.load(model_path, map_location=device))
[I 2025-04-01 15:40:27,931] Trial 12 finished with value: 0.9887318905383652 and parameters: {'lr': 4.508114599732495e-06, 'weight_decay': 0.0007159176999849116, 'loss_fn': 'CrossEntropy', 'optimizer': 'RMSprop'}. Best is trial 7 with value: 0.9890739745656457.
C:\Users\sthem\AppData\Local\Temp\ipykernel_36240\549330364.py:76: FutureWarning: You are using `torch.load` with `weights_only=False` (the current default value), which uses the default pickle module implicitly. It is possible to construct malicious pickle data which will execute arbitrary code during unpickling (See https://github.com/pytorch/pytorch/blob/main/SECURITY.md#untrusted-models for more details). In a future release, the default value for `weights_only` will be flipped to `True`. This limits the functions that could be executed during unpickling. Arbitrary objects will no longer be allowed to be loaded via this mode unless they are explicitly allowlisted by the user via `torch.serialization.add_safe_globals`. We recommend you start setting `weights_only=True` for any use case where you don't have full control of the loaded file. Please open an issue on GitHub for any issues related to this experimental feature.
  model.load_state_dict(torch.load(model_path, map_location=device))
[I 2025-04-01 15:44:57,311] Trial 13 finished with value: 0.9885550786838341 and parameters: {'lr': 1.8817752648402603e-05, 'weight_decay': 0.00025891870807130126, 'loss_fn': 'CrossEntropy', 'optimizer': 'RMSprop'}. Best is trial 7 with value: 0.9890739745656457.
C:\Users\sthem\AppData\Local\Temp\ipykernel_36240\549330364.py:76: FutureWarning: You are using `torch.load` with `weights_only=False` (the current default value), which uses the default pickle module implicitly. It is possible to construct malicious pickle data which will execute arbitrary code during unpickling (See https://github.com/pytorch/pytorch/blob/main/SECURITY.md#untrusted-models for more details). In a future release, the default value for `weights_only` will be flipped to `True`. This limits the functions that could be executed during unpickling. Arbitrary objects will no longer be allowed to be loaded via this mode unless they are explicitly allowlisted by the user via `torch.serialization.add_safe_globals`. We recommend you start setting `weights_only=True` for any use case where you don't have full control of the loaded file. Please open an issue on GitHub for any issues related to this experimental feature.
  model.load_state_dict(torch.load(model_path, map_location=device))
[I 2025-04-01 15:49:26,506] Trial 14 finished with value: 0.9892665474060823 and parameters: {'lr': 4.822937931069502e-06, 'weight_decay': 1.3488633724130625e-05, 'loss_fn': 'CrossEntropy', 'optimizer': 'RMSprop'}. Best is trial 14 with value: 0.9892665474060823.
C:\Users\sthem\AppData\Local\Temp\ipykernel_36240\549330364.py:76: FutureWarning: You are using `torch.load` with `weights_only=False` (the current default value), which uses the default pickle module implicitly. It is possible to construct malicious pickle data which will execute arbitrary code during unpickling (See https://github.com/pytorch/pytorch/blob/main/SECURITY.md#untrusted-models for more details). In a future release, the default value for `weights_only` will be flipped to `True`. This limits the functions that could be executed during unpickling. Arbitrary objects will no longer be allowed to be loaded via this mode unless they are explicitly allowlisted by the user via `torch.serialization.add_safe_globals`. We recommend you start setting `weights_only=True` for any use case where you don't have full control of the loaded file. Please open an issue on GitHub for any issues related to this experimental feature.
  model.load_state_dict(torch.load(model_path, map_location=device))
[I 2025-04-01 15:53:51,057] Trial 15 finished with value: 0.9876675603217158 and parameters: {'lr': 1.8747502313834544e-06, 'weight_decay': 4.704992740025008e-06, 'loss_fn': 'CrossEntropy', 'optimizer': 'SGD'}. Best is trial 14 with value: 0.9892665474060823.
C:\Users\sthem\AppData\Local\Temp\ipykernel_36240\549330364.py:76: FutureWarning: You are using `torch.load` with `weights_only=False` (the current default value), which uses the default pickle module implicitly. It is possible to construct malicious pickle data which will execute arbitrary code during unpickling (See https://github.com/pytorch/pytorch/blob/main/SECURITY.md#untrusted-models for more details). In a future release, the default value for `weights_only` will be flipped to `True`. This limits the functions that could be executed during unpickling. Arbitrary objects will no longer be allowed to be loaded via this mode unless they are explicitly allowlisted by the user via `torch.serialization.add_safe_globals`. We recommend you start setting `weights_only=True` for any use case where you don't have full control of the loaded file. Please open an issue on GitHub for any issues related to this experimental feature.
  model.load_state_dict(torch.load(model_path, map_location=device))
