[I 2025-04-01 17:01:18,573] A new study created in memory with name: no-name-a3e992c0-5e7d-4baf-bc97-94697a726e2b
C:\Users\sthem\AppData\Local\Temp\ipykernel_36880\1920985626.py:76: FutureWarning: You are using `torch.load` with `weights_only=False` (the current default value), which uses the default pickle module implicitly. It is possible to construct malicious pickle data which will execute arbitrary code during unpickling (See https://github.com/pytorch/pytorch/blob/main/SECURITY.md#untrusted-models for more details). In a future release, the default value for `weights_only` will be flipped to `True`. This limits the functions that could be executed during unpickling. Arbitrary objects will no longer be allowed to be loaded via this mode unless they are explicitly allowlisted by the user via `torch.serialization.add_safe_globals`. We recommend you start setting `weights_only=True` for any use case where you don't have full control of the loaded file. Please open an issue on GitHub for any issues related to this experimental feature.
  model.load_state_dict(torch.load(model_path, map_location=device))
[I 2025-04-01 17:04:27,574] Trial 0 finished with value: 0.9919883466860888 and parameters: {'lr': 6.699926074476614e-06, 'weight_decay': 0.007972932378678384, 'loss_fn': 'BCE', 'optimizer': 'SGD'}. Best is trial 0 with value: 0.9919883466860888.
C:\Users\sthem\AppData\Local\Temp\ipykernel_36880\1920985626.py:76: FutureWarning: You are using `torch.load` with `weights_only=False` (the current default value), which uses the default pickle module implicitly. It is possible to construct malicious pickle data which will execute arbitrary code during unpickling (See https://github.com/pytorch/pytorch/blob/main/SECURITY.md#untrusted-models for more details). In a future release, the default value for `weights_only` will be flipped to `True`. This limits the functions that could be executed during unpickling. Arbitrary objects will no longer be allowed to be loaded via this mode unless they are explicitly allowlisted by the user via `torch.serialization.add_safe_globals`. We recommend you start setting `weights_only=True` for any use case where you don't have full control of the loaded file. Please open an issue on GitHub for any issues related to this experimental feature.
  model.load_state_dict(torch.load(model_path, map_location=device))
[I 2025-04-01 17:07:35,120] Trial 1 finished with value: 0.9906951286261632 and parameters: {'lr': 2.081249479802079e-05, 'weight_decay': 0.00029279321000313246, 'loss_fn': 'BCE', 'optimizer': 'RMSprop'}. Best is trial 0 with value: 0.9919883466860888.
C:\Users\sthem\AppData\Local\Temp\ipykernel_36880\1920985626.py:76: FutureWarning: You are using `torch.load` with `weights_only=False` (the current default value), which uses the default pickle module implicitly. It is possible to construct malicious pickle data which will execute arbitrary code during unpickling (See https://github.com/pytorch/pytorch/blob/main/SECURITY.md#untrusted-models for more details). In a future release, the default value for `weights_only` will be flipped to `True`. This limits the functions that could be executed during unpickling. Arbitrary objects will no longer be allowed to be loaded via this mode unless they are explicitly allowlisted by the user via `torch.serialization.add_safe_globals`. We recommend you start setting `weights_only=True` for any use case where you don't have full control of the loaded file. Please open an issue on GitHub for any issues related to this experimental feature.
  model.load_state_dict(torch.load(model_path, map_location=device))
[I 2025-04-01 17:10:37,967] Trial 2 finished with value: 0.9916272297051328 and parameters: {'lr': 4.213171601434318e-05, 'weight_decay': 0.003921646474842651, 'loss_fn': 'CrossEntropy', 'optimizer': 'SGD'}. Best is trial 0 with value: 0.9919883466860888.
C:\Users\sthem\AppData\Local\Temp\ipykernel_36880\1920985626.py:76: FutureWarning: You are using `torch.load` with `weights_only=False` (the current default value), which uses the default pickle module implicitly. It is possible to construct malicious pickle data which will execute arbitrary code during unpickling (See https://github.com/pytorch/pytorch/blob/main/SECURITY.md#untrusted-models for more details). In a future release, the default value for `weights_only` will be flipped to `True`. This limits the functions that could be executed during unpickling. Arbitrary objects will no longer be allowed to be loaded via this mode unless they are explicitly allowlisted by the user via `torch.serialization.add_safe_globals`. We recommend you start setting `weights_only=True` for any use case where you don't have full control of the loaded file. Please open an issue on GitHub for any issues related to this experimental feature.
  model.load_state_dict(torch.load(model_path, map_location=device))
[I 2025-04-01 17:13:44,319] Trial 3 finished with value: 0.9912344777209642 and parameters: {'lr': 2.564810802144357e-05, 'weight_decay': 0.005588762943535197, 'loss_fn': 'BCE', 'optimizer': 'RMSprop'}. Best is trial 0 with value: 0.9919883466860888.
C:\Users\sthem\AppData\Local\Temp\ipykernel_36880\1920985626.py:76: FutureWarning: You are using `torch.load` with `weights_only=False` (the current default value), which uses the default pickle module implicitly. It is possible to construct malicious pickle data which will execute arbitrary code during unpickling (See https://github.com/pytorch/pytorch/blob/main/SECURITY.md#untrusted-models for more details). In a future release, the default value for `weights_only` will be flipped to `True`. This limits the functions that could be executed during unpickling. Arbitrary objects will no longer be allowed to be loaded via this mode unless they are explicitly allowlisted by the user via `torch.serialization.add_safe_globals`. We recommend you start setting `weights_only=True` for any use case where you don't have full control of the loaded file. Please open an issue on GitHub for any issues related to this experimental feature.
  model.load_state_dict(torch.load(model_path, map_location=device))
[I 2025-04-01 17:16:52,521] Trial 4 finished with value: 0.990872581234027 and parameters: {'lr': 1.3962707795946833e-06, 'weight_decay': 1.7430649102586738e-05, 'loss_fn': 'CrossEntropy', 'optimizer': 'Adam'}. Best is trial 0 with value: 0.9919883466860888.
C:\Users\sthem\AppData\Local\Temp\ipykernel_36880\1920985626.py:76: FutureWarning: You are using `torch.load` with `weights_only=False` (the current default value), which uses the default pickle module implicitly. It is possible to construct malicious pickle data which will execute arbitrary code during unpickling (See https://github.com/pytorch/pytorch/blob/main/SECURITY.md#untrusted-models for more details). In a future release, the default value for `weights_only` will be flipped to `True`. This limits the functions that could be executed during unpickling. Arbitrary objects will no longer be allowed to be loaded via this mode unless they are explicitly allowlisted by the user via `torch.serialization.add_safe_globals`. We recommend you start setting `weights_only=True` for any use case where you don't have full control of the loaded file. Please open an issue on GitHub for any issues related to this experimental feature.
  model.load_state_dict(torch.load(model_path, map_location=device))
[I 2025-04-01 17:19:58,886] Trial 5 finished with value: 0.9722681359044996 and parameters: {'lr': 0.00025090970848172327, 'weight_decay': 4.231028601231084e-06, 'loss_fn': 'BCE', 'optimizer': 'RMSprop'}. Best is trial 0 with value: 0.9919883466860888.
C:\Users\sthem\AppData\Local\Temp\ipykernel_36880\1920985626.py:76: FutureWarning: You are using `torch.load` with `weights_only=False` (the current default value), which uses the default pickle module implicitly. It is possible to construct malicious pickle data which will execute arbitrary code during unpickling (See https://github.com/pytorch/pytorch/blob/main/SECURITY.md#untrusted-models for more details). In a future release, the default value for `weights_only` will be flipped to `True`. This limits the functions that could be executed during unpickling. Arbitrary objects will no longer be allowed to be loaded via this mode unless they are explicitly allowlisted by the user via `torch.serialization.add_safe_globals`. We recommend you start setting `weights_only=True` for any use case where you don't have full control of the loaded file. Please open an issue on GitHub for any issues related to this experimental feature.
  model.load_state_dict(torch.load(model_path, map_location=device))
[I 2025-04-01 17:23:06,861] Trial 6 finished with value: 0.9901387874360847 and parameters: {'lr': 5.633137221461469e-06, 'weight_decay': 8.099568258119188e-06, 'loss_fn': 'BCE', 'optimizer': 'Adam'}. Best is trial 0 with value: 0.9919883466860888.
C:\Users\sthem\AppData\Local\Temp\ipykernel_36880\1920985626.py:76: FutureWarning: You are using `torch.load` with `weights_only=False` (the current default value), which uses the default pickle module implicitly. It is possible to construct malicious pickle data which will execute arbitrary code during unpickling (See https://github.com/pytorch/pytorch/blob/main/SECURITY.md#untrusted-models for more details). In a future release, the default value for `weights_only` will be flipped to `True`. This limits the functions that could be executed during unpickling. Arbitrary objects will no longer be allowed to be loaded via this mode unless they are explicitly allowlisted by the user via `torch.serialization.add_safe_globals`. We recommend you start setting `weights_only=True` for any use case where you don't have full control of the loaded file. Please open an issue on GitHub for any issues related to this experimental feature.
  model.load_state_dict(torch.load(model_path, map_location=device))
[I 2025-04-01 17:26:13,025] Trial 7 finished with value: 0.990174672489083 and parameters: {'lr': 1.8914716543713455e-05, 'weight_decay': 3.0242083911771153e-05, 'loss_fn': 'BCE', 'optimizer': 'RMSprop'}. Best is trial 0 with value: 0.9919883466860888.
C:\Users\sthem\AppData\Local\Temp\ipykernel_36880\1920985626.py:76: FutureWarning: You are using `torch.load` with `weights_only=False` (the current default value), which uses the default pickle module implicitly. It is possible to construct malicious pickle data which will execute arbitrary code during unpickling (See https://github.com/pytorch/pytorch/blob/main/SECURITY.md#untrusted-models for more details). In a future release, the default value for `weights_only` will be flipped to `True`. This limits the functions that could be executed during unpickling. Arbitrary objects will no longer be allowed to be loaded via this mode unless they are explicitly allowlisted by the user via `torch.serialization.add_safe_globals`. We recommend you start setting `weights_only=True` for any use case where you don't have full control of the loaded file. Please open an issue on GitHub for any issues related to this experimental feature.
  model.load_state_dict(torch.load(model_path, map_location=device))
[I 2025-04-01 17:29:20,886] Trial 8 finished with value: 0.987281976744186 and parameters: {'lr': 5.9185720596066605e-05, 'weight_decay': 1.8583366143446153e-06, 'loss_fn': 'BCE', 'optimizer': 'Adam'}. Best is trial 0 with value: 0.9919883466860888.
C:\Users\sthem\AppData\Local\Temp\ipykernel_36880\1920985626.py:76: FutureWarning: You are using `torch.load` with `weights_only=False` (the current default value), which uses the default pickle module implicitly. It is possible to construct malicious pickle data which will execute arbitrary code during unpickling (See https://github.com/pytorch/pytorch/blob/main/SECURITY.md#untrusted-models for more details). In a future release, the default value for `weights_only` will be flipped to `True`. This limits the functions that could be executed during unpickling. Arbitrary objects will no longer be allowed to be loaded via this mode unless they are explicitly allowlisted by the user via `torch.serialization.add_safe_globals`. We recommend you start setting `weights_only=True` for any use case where you don't have full control of the loaded file. Please open an issue on GitHub for any issues related to this experimental feature.
  model.load_state_dict(torch.load(model_path, map_location=device))
[I 2025-04-01 17:32:27,084] Trial 9 finished with value: 0.981626341640895 and parameters: {'lr': 0.00014084153150850678, 'weight_decay': 7.669093868168667e-06, 'loss_fn': 'CrossEntropy', 'optimizer': 'RMSprop'}. Best is trial 0 with value: 0.9919883466860888.
C:\Users\sthem\AppData\Local\Temp\ipykernel_36880\1920985626.py:76: FutureWarning: You are using `torch.load` with `weights_only=False` (the current default value), which uses the default pickle module implicitly. It is possible to construct malicious pickle data which will execute arbitrary code during unpickling (See https://github.com/pytorch/pytorch/blob/main/SECURITY.md#untrusted-models for more details). In a future release, the default value for `weights_only` will be flipped to `True`. This limits the functions that could be executed during unpickling. Arbitrary objects will no longer be allowed to be loaded via this mode unless they are explicitly allowlisted by the user via `torch.serialization.add_safe_globals`. We recommend you start setting `weights_only=True` for any use case where you don't have full control of the loaded file. Please open an issue on GitHub for any issues related to this experimental feature.
  model.load_state_dict(torch.load(model_path, map_location=device))
[I 2025-04-01 17:35:29,731] Trial 10 finished with value: 0.9912536443148688 and parameters: {'lr': 0.0008868095031747402, 'weight_decay': 0.0004246320006180543, 'loss_fn': 'CrossEntropy', 'optimizer': 'SGD'}. Best is trial 0 with value: 0.9919883466860888.
C:\Users\sthem\AppData\Local\Temp\ipykernel_36880\1920985626.py:76: FutureWarning: You are using `torch.load` with `weights_only=False` (the current default value), which uses the default pickle module implicitly. It is possible to construct malicious pickle data which will execute arbitrary code during unpickling (See https://github.com/pytorch/pytorch/blob/main/SECURITY.md#untrusted-models for more details). In a future release, the default value for `weights_only` will be flipped to `True`. This limits the functions that could be executed during unpickling. Arbitrary objects will no longer be allowed to be loaded via this mode unless they are explicitly allowlisted by the user via `torch.serialization.add_safe_globals`. We recommend you start setting `weights_only=True` for any use case where you don't have full control of the loaded file. Please open an issue on GitHub for any issues related to this experimental feature.
  model.load_state_dict(torch.load(model_path, map_location=device))
[I 2025-04-01 17:38:33,051] Trial 11 finished with value: 0.991807755324959 and parameters: {'lr': 4.2256306229740245e-06, 'weight_decay': 0.00866349545818721, 'loss_fn': 'CrossEntropy', 'optimizer': 'SGD'}. Best is trial 0 with value: 0.9919883466860888.
C:\Users\sthem\AppData\Local\Temp\ipykernel_36880\1920985626.py:76: FutureWarning: You are using `torch.load` with `weights_only=False` (the current default value), which uses the default pickle module implicitly. It is possible to construct malicious pickle data which will execute arbitrary code during unpickling (See https://github.com/pytorch/pytorch/blob/main/SECURITY.md#untrusted-models for more details). In a future release, the default value for `weights_only` will be flipped to `True`. This limits the functions that could be executed during unpickling. Arbitrary objects will no longer be allowed to be loaded via this mode unless they are explicitly allowlisted by the user via `torch.serialization.add_safe_globals`. We recommend you start setting `weights_only=True` for any use case where you don't have full control of the loaded file. Please open an issue on GitHub for any issues related to this experimental feature.
  model.load_state_dict(torch.load(model_path, map_location=device))
[I 2025-04-01 17:41:41,572] Trial 12 finished with value: 0.991810737033667 and parameters: {'lr': 3.5625415420746942e-06, 'weight_decay': 0.0013219462544691789, 'loss_fn': 'CrossEntropy', 'optimizer': 'SGD'}. Best is trial 0 with value: 0.9919883466860888.
C:\Users\sthem\AppData\Local\Temp\ipykernel_36880\1920985626.py:76: FutureWarning: You are using `torch.load` with `weights_only=False` (the current default value), which uses the default pickle module implicitly. It is possible to construct malicious pickle data which will execute arbitrary code during unpickling (See https://github.com/pytorch/pytorch/blob/main/SECURITY.md#untrusted-models for more details). In a future release, the default value for `weights_only` will be flipped to `True`. This limits the functions that could be executed during unpickling. Arbitrary objects will no longer be allowed to be loaded via this mode unless they are explicitly allowlisted by the user via `torch.serialization.add_safe_globals`. We recommend you start setting `weights_only=True` for any use case where you don't have full control of the loaded file. Please open an issue on GitHub for any issues related to this experimental feature.
  model.load_state_dict(torch.load(model_path, map_location=device))
[I 2025-04-01 17:44:45,842] Trial 13 finished with value: 0.9914405390639228 and parameters: {'lr': 4.517465165270842e-06, 'weight_decay': 0.0009363711262356072, 'loss_fn': 'CrossEntropy', 'optimizer': 'SGD'}. Best is trial 0 with value: 0.9919883466860888.
C:\Users\sthem\AppData\Local\Temp\ipykernel_36880\1920985626.py:76: FutureWarning: You are using `torch.load` with `weights_only=False` (the current default value), which uses the default pickle module implicitly. It is possible to construct malicious pickle data which will execute arbitrary code during unpickling (See https://github.com/pytorch/pytorch/blob/main/SECURITY.md#untrusted-models for more details). In a future release, the default value for `weights_only` will be flipped to `True`. This limits the functions that could be executed during unpickling. Arbitrary objects will no longer be allowed to be loaded via this mode unless they are explicitly allowlisted by the user via `torch.serialization.add_safe_globals`. We recommend you start setting `weights_only=True` for any use case where you don't have full control of the loaded file. Please open an issue on GitHub for any issues related to this experimental feature.
  model.load_state_dict(torch.load(model_path, map_location=device))
[I 2025-04-01 17:47:48,625] Trial 14 finished with value: 0.991810737033667 and parameters: {'lr': 1.2088035216021101e-06, 'weight_decay': 0.0015349868841234764, 'loss_fn': 'BCE', 'optimizer': 'SGD'}. Best is trial 0 with value: 0.9919883466860888.
C:\Users\sthem\AppData\Local\Temp\ipykernel_36880\1920985626.py:76: FutureWarning: You are using `torch.load` with `weights_only=False` (the current default value), which uses the default pickle module implicitly. It is possible to construct malicious pickle data which will execute arbitrary code during unpickling (See https://github.com/pytorch/pytorch/blob/main/SECURITY.md#untrusted-models for more details). In a future release, the default value for `weights_only` will be flipped to `True`. This limits the functions that could be executed during unpickling. Arbitrary objects will no longer be allowed to be loaded via this mode unless they are explicitly allowlisted by the user via `torch.serialization.add_safe_globals`. We recommend you start setting `weights_only=True` for any use case where you don't have full control of the loaded file. Please open an issue on GitHub for any issues related to this experimental feature.
  model.load_state_dict(torch.load(model_path, map_location=device))
[I 2025-04-01 17:50:51,487] Trial 15 finished with value: 0.9914280503374066 and parameters: {'lr': 9.082820878763224e-06, 'weight_decay': 0.0001308137681036853, 'loss_fn': 'CrossEntropy', 'optimizer': 'SGD'}. Best is trial 0 with value: 0.9919883466860888.
C:\Users\sthem\AppData\Local\Temp\ipykernel_36880\1920985626.py:76: FutureWarning: You are using `torch.load` with `weights_only=False` (the current default value), which uses the default pickle module implicitly. It is possible to construct malicious pickle data which will execute arbitrary code during unpickling (See https://github.com/pytorch/pytorch/blob/main/SECURITY.md#untrusted-models for more details). In a future release, the default value for `weights_only` will be flipped to `True`. This limits the functions that could be executed during unpickling. Arbitrary objects will no longer be allowed to be loaded via this mode unless they are explicitly allowlisted by the user via `torch.serialization.add_safe_globals`. We recommend you start setting `weights_only=True` for any use case where you don't have full control of the loaded file. Please open an issue on GitHub for any issues related to this experimental feature.
  model.load_state_dict(torch.load(model_path, map_location=device))
