[I 2025-04-01 17:53:54,148] Trial 16 finished with value: 0.9914467697907189 and parameters: {'lr': 2.4733238367685377e-06, 'weight_decay': 0.0017310376219981441, 'loss_fn': 'BCE', 'optimizer': 'SGD'}. Best is trial 0 with value: 0.9919883466860888.
C:\Users\sthem\AppData\Local\Temp\ipykernel_36880\1920985626.py:76: FutureWarning: You are using `torch.load` with `weights_only=False` (the current default value), which uses the default pickle module implicitly. It is possible to construct malicious pickle data which will execute arbitrary code during unpickling (See https://github.com/pytorch/pytorch/blob/main/SECURITY.md#untrusted-models for more details). In a future release, the default value for `weights_only` will be flipped to `True`. This limits the functions that could be executed during unpickling. Arbitrary objects will no longer be allowed to be loaded via this mode unless they are explicitly allowlisted by the user via `torch.serialization.add_safe_globals`. We recommend you start setting `weights_only=True` for any use case where you don't have full control of the loaded file. Please open an issue on GitHub for any issues related to this experimental feature.
  model.load_state_dict(torch.load(model_path, map_location=device))
[I 2025-04-01 17:56:56,599] Trial 17 finished with value: 0.9916241806263656 and parameters: {'lr': 1.0033432009671089e-05, 'weight_decay': 0.00236941427991448, 'loss_fn': 'CrossEntropy', 'optimizer': 'SGD'}. Best is trial 0 with value: 0.9919883466860888.
C:\Users\sthem\AppData\Local\Temp\ipykernel_36880\1920985626.py:76: FutureWarning: You are using `torch.load` with `weights_only=False` (the current default value), which uses the default pickle module implicitly. It is possible to construct malicious pickle data which will execute arbitrary code during unpickling (See https://github.com/pytorch/pytorch/blob/main/SECURITY.md#untrusted-models for more details). In a future release, the default value for `weights_only` will be flipped to `True`. This limits the functions that could be executed during unpickling. Arbitrary objects will no longer be allowed to be loaded via this mode unless they are explicitly allowlisted by the user via `torch.serialization.add_safe_globals`. We recommend you start setting `weights_only=True` for any use case where you don't have full control of the loaded file. Please open an issue on GitHub for any issues related to this experimental feature.
  model.load_state_dict(torch.load(model_path, map_location=device))
[I 2025-04-01 18:00:01,250] Trial 18 finished with value: 0.991991263196214 and parameters: {'lr': 2.218128173068742e-06, 'weight_decay': 0.009933567940425485, 'loss_fn': 'BCE', 'optimizer': 'SGD'}. Best is trial 18 with value: 0.991991263196214.
C:\Users\sthem\AppData\Local\Temp\ipykernel_36880\1920985626.py:76: FutureWarning: You are using `torch.load` with `weights_only=False` (the current default value), which uses the default pickle module implicitly. It is possible to construct malicious pickle data which will execute arbitrary code during unpickling (See https://github.com/pytorch/pytorch/blob/main/SECURITY.md#untrusted-models for more details). In a future release, the default value for `weights_only` will be flipped to `True`. This limits the functions that could be executed during unpickling. Arbitrary objects will no longer be allowed to be loaded via this mode unless they are explicitly allowlisted by the user via `torch.serialization.add_safe_globals`. We recommend you start setting `weights_only=True` for any use case where you don't have full control of the loaded file. Please open an issue on GitHub for any issues related to this experimental feature.
  model.load_state_dict(torch.load(model_path, map_location=device))
[I 2025-04-01 18:03:06,367] Trial 19 finished with value: 0.9918017853889597 and parameters: {'lr': 2.100500279828013e-06, 'weight_decay': 0.009021992368445544, 'loss_fn': 'BCE', 'optimizer': 'SGD'}. Best is trial 18 with value: 0.991991263196214.
C:\Users\sthem\AppData\Local\Temp\ipykernel_36880\1920985626.py:76: FutureWarning: You are using `torch.load` with `weights_only=False` (the current default value), which uses the default pickle module implicitly. It is possible to construct malicious pickle data which will execute arbitrary code during unpickling (See https://github.com/pytorch/pytorch/blob/main/SECURITY.md#untrusted-models for more details). In a future release, the default value for `weights_only` will be flipped to `True`. This limits the functions that could be executed during unpickling. Arbitrary objects will no longer be allowed to be loaded via this mode unless they are explicitly allowlisted by the user via `torch.serialization.add_safe_globals`. We recommend you start setting `weights_only=True` for any use case where you don't have full control of the loaded file. Please open an issue on GitHub for any issues related to this experimental feature.
  model.load_state_dict(torch.load(model_path, map_location=device))
[I 2025-04-01 18:06:16,907] Trial 20 finished with value: 0.9907120743034056 and parameters: {'lr': 9.513173290920694e-06, 'weight_decay': 5.981250454660108e-05, 'loss_fn': 'BCE', 'optimizer': 'Adam'}. Best is trial 18 with value: 0.991991263196214.
C:\Users\sthem\AppData\Local\Temp\ipykernel_36880\1920985626.py:76: FutureWarning: You are using `torch.load` with `weights_only=False` (the current default value), which uses the default pickle module implicitly. It is possible to construct malicious pickle data which will execute arbitrary code during unpickling (See https://github.com/pytorch/pytorch/blob/main/SECURITY.md#untrusted-models for more details). In a future release, the default value for `weights_only` will be flipped to `True`. This limits the functions that could be executed during unpickling. Arbitrary objects will no longer be allowed to be loaded via this mode unless they are explicitly allowlisted by the user via `torch.serialization.add_safe_globals`. We recommend you start setting `weights_only=True` for any use case where you don't have full control of the loaded file. Please open an issue on GitHub for any issues related to this experimental feature.
  model.load_state_dict(torch.load(model_path, map_location=device))
[I 2025-04-01 18:09:22,345] Trial 21 finished with value: 0.991810737033667 and parameters: {'lr': 2.834179423671357e-06, 'weight_decay': 0.0006904960791940279, 'loss_fn': 'BCE', 'optimizer': 'SGD'}. Best is trial 18 with value: 0.991991263196214.
C:\Users\sthem\AppData\Local\Temp\ipykernel_36880\1920985626.py:76: FutureWarning: You are using `torch.load` with `weights_only=False` (the current default value), which uses the default pickle module implicitly. It is possible to construct malicious pickle data which will execute arbitrary code during unpickling (See https://github.com/pytorch/pytorch/blob/main/SECURITY.md#untrusted-models for more details). In a future release, the default value for `weights_only` will be flipped to `True`. This limits the functions that could be executed during unpickling. Arbitrary objects will no longer be allowed to be loaded via this mode unless they are explicitly allowlisted by the user via `torch.serialization.add_safe_globals`. We recommend you start setting `weights_only=True` for any use case where you don't have full control of the loaded file. Please open an issue on GitHub for any issues related to this experimental feature.
  model.load_state_dict(torch.load(model_path, map_location=device))
[I 2025-04-01 18:12:19,506] Trial 22 finished with value: 0.991810737033667 and parameters: {'lr': 1.1359067851766055e-06, 'weight_decay': 0.003910907120206296, 'loss_fn': 'BCE', 'optimizer': 'SGD'}. Best is trial 18 with value: 0.991991263196214.
C:\Users\sthem\AppData\Local\Temp\ipykernel_36880\1920985626.py:76: FutureWarning: You are using `torch.load` with `weights_only=False` (the current default value), which uses the default pickle module implicitly. It is possible to construct malicious pickle data which will execute arbitrary code during unpickling (See https://github.com/pytorch/pytorch/blob/main/SECURITY.md#untrusted-models for more details). In a future release, the default value for `weights_only` will be flipped to `True`. This limits the functions that could be executed during unpickling. Arbitrary objects will no longer be allowed to be loaded via this mode unless they are explicitly allowlisted by the user via `torch.serialization.add_safe_globals`. We recommend you start setting `weights_only=True` for any use case where you don't have full control of the loaded file. Please open an issue on GitHub for any issues related to this experimental feature.
  model.load_state_dict(torch.load(model_path, map_location=device))
[I 2025-04-01 18:15:15,908] Trial 23 finished with value: 0.9914405390639228 and parameters: {'lr': 5.673195048356368e-06, 'weight_decay': 0.009407434860662962, 'loss_fn': 'CrossEntropy', 'optimizer': 'SGD'}. Best is trial 18 with value: 0.991991263196214.
C:\Users\sthem\AppData\Local\Temp\ipykernel_36880\1920985626.py:76: FutureWarning: You are using `torch.load` with `weights_only=False` (the current default value), which uses the default pickle module implicitly. It is possible to construct malicious pickle data which will execute arbitrary code during unpickling (See https://github.com/pytorch/pytorch/blob/main/SECURITY.md#untrusted-models for more details). In a future release, the default value for `weights_only` will be flipped to `True`. This limits the functions that could be executed during unpickling. Arbitrary objects will no longer be allowed to be loaded via this mode unless they are explicitly allowlisted by the user via `torch.serialization.add_safe_globals`. We recommend you start setting `weights_only=True` for any use case where you don't have full control of the loaded file. Please open an issue on GitHub for any issues related to this experimental feature.
  model.load_state_dict(torch.load(model_path, map_location=device))
[I 2025-04-01 18:18:12,293] Trial 24 finished with value: 0.9921747042766151 and parameters: {'lr': 2.7558006510610155e-06, 'weight_decay': 0.00016835642992830158, 'loss_fn': 'BCE', 'optimizer': 'SGD'}. Best is trial 24 with value: 0.9921747042766151.
C:\Users\sthem\AppData\Local\Temp\ipykernel_36880\1920985626.py:76: FutureWarning: You are using `torch.load` with `weights_only=False` (the current default value), which uses the default pickle module implicitly. It is possible to construct malicious pickle data which will execute arbitrary code during unpickling (See https://github.com/pytorch/pytorch/blob/main/SECURITY.md#untrusted-models for more details). In a future release, the default value for `weights_only` will be flipped to `True`. This limits the functions that could be executed during unpickling. Arbitrary objects will no longer be allowed to be loaded via this mode unless they are explicitly allowlisted by the user via `torch.serialization.add_safe_globals`. We recommend you start setting `weights_only=True` for any use case where you don't have full control of the loaded file. Please open an issue on GitHub for any issues related to this experimental feature.
  model.load_state_dict(torch.load(model_path, map_location=device))
[I 2025-04-01 18:21:08,663] Trial 25 finished with value: 0.9918017853889597 and parameters: {'lr': 1.292172544860673e-05, 'weight_decay': 0.00017743571434159394, 'loss_fn': 'BCE', 'optimizer': 'SGD'}. Best is trial 24 with value: 0.9921747042766151.
C:\Users\sthem\AppData\Local\Temp\ipykernel_36880\1920985626.py:76: FutureWarning: You are using `torch.load` with `weights_only=False` (the current default value), which uses the default pickle module implicitly. It is possible to construct malicious pickle data which will execute arbitrary code during unpickling (See https://github.com/pytorch/pytorch/blob/main/SECURITY.md#untrusted-models for more details). In a future release, the default value for `weights_only` will be flipped to `True`. This limits the functions that could be executed during unpickling. Arbitrary objects will no longer be allowed to be loaded via this mode unless they are explicitly allowlisted by the user via `torch.serialization.add_safe_globals`. We recommend you start setting `weights_only=True` for any use case where you don't have full control of the loaded file. Please open an issue on GitHub for any issues related to this experimental feature.
  model.load_state_dict(torch.load(model_path, map_location=device))
[I 2025-04-01 18:24:05,221] Trial 26 finished with value: 0.9914405390639228 and parameters: {'lr': 1.9436570255414874e-06, 'weight_decay': 6.455638923870971e-05, 'loss_fn': 'BCE', 'optimizer': 'SGD'}. Best is trial 24 with value: 0.9921747042766151.
C:\Users\sthem\AppData\Local\Temp\ipykernel_36880\1920985626.py:76: FutureWarning: You are using `torch.load` with `weights_only=False` (the current default value), which uses the default pickle module implicitly. It is possible to construct malicious pickle data which will execute arbitrary code during unpickling (See https://github.com/pytorch/pytorch/blob/main/SECURITY.md#untrusted-models for more details). In a future release, the default value for `weights_only` will be flipped to `True`. This limits the functions that could be executed during unpickling. Arbitrary objects will no longer be allowed to be loaded via this mode unless they are explicitly allowlisted by the user via `torch.serialization.add_safe_globals`. We recommend you start setting `weights_only=True` for any use case where you don't have full control of the loaded file. Please open an issue on GitHub for any issues related to this experimental feature.
  model.load_state_dict(torch.load(model_path, map_location=device))
[I 2025-04-01 18:27:02,350] Trial 27 finished with value: 0.9916211293260474 and parameters: {'lr': 1.8954280255999977e-06, 'weight_decay': 0.002956282546739109, 'loss_fn': 'BCE', 'optimizer': 'SGD'}. Best is trial 24 with value: 0.9921747042766151.
C:\Users\sthem\AppData\Local\Temp\ipykernel_36880\1920985626.py:76: FutureWarning: You are using `torch.load` with `weights_only=False` (the current default value), which uses the default pickle module implicitly. It is possible to construct malicious pickle data which will execute arbitrary code during unpickling (See https://github.com/pytorch/pytorch/blob/main/SECURITY.md#untrusted-models for more details). In a future release, the default value for `weights_only` will be flipped to `True`. This limits the functions that could be executed during unpickling. Arbitrary objects will no longer be allowed to be loaded via this mode unless they are explicitly allowlisted by the user via `torch.serialization.add_safe_globals`. We recommend you start setting `weights_only=True` for any use case where you don't have full control of the loaded file. Please open an issue on GitHub for any issues related to this experimental feature.
  model.load_state_dict(torch.load(model_path, map_location=device))
[I 2025-04-01 18:30:12,902] Trial 28 finished with value: 0.9910730552013117 and parameters: {'lr': 7.856363163208538e-06, 'weight_decay': 0.0004769890715373432, 'loss_fn': 'BCE', 'optimizer': 'Adam'}. Best is trial 24 with value: 0.9921747042766151.
C:\Users\sthem\AppData\Local\Temp\ipykernel_36880\1920985626.py:76: FutureWarning: You are using `torch.load` with `weights_only=False` (the current default value), which uses the default pickle module implicitly. It is possible to construct malicious pickle data which will execute arbitrary code during unpickling (See https://github.com/pytorch/pytorch/blob/main/SECURITY.md#untrusted-models for more details). In a future release, the default value for `weights_only` will be flipped to `True`. This limits the functions that could be executed during unpickling. Arbitrary objects will no longer be allowed to be loaded via this mode unless they are explicitly allowlisted by the user via `torch.serialization.add_safe_globals`. We recommend you start setting `weights_only=True` for any use case where you don't have full control of the loaded file. Please open an issue on GitHub for any issues related to this experimental feature.
  model.load_state_dict(torch.load(model_path, map_location=device))
[I 2025-04-01 18:33:18,317] Trial 29 finished with value: 0.9912600145666424 and parameters: {'lr': 1.623880216076114e-05, 'weight_decay': 1.2262594634813318e-06, 'loss_fn': 'BCE', 'optimizer': 'SGD'}. Best is trial 24 with value: 0.9921747042766151.

Study statistics: 
  Number of finished trials:  30
  Number of pruned trials:  0
  Number of complete trials:  30
Best trial:
  Value:  0.9921747042766151
  Params: 
    lr: 2.7558006510610155e-06
    weight_decay: 0.00016835642992830158
    loss_fn: BCE
    optimizer: SGD